{
  "$schema": "https://memory-os.example/schemas/security/import-preview.v1.schema.json",
  "schemaVersion": 1,
  "previewId": "prev_01J0000000000000000000000",
  "jobId": "job_01J000000000000000000000000",
  "ownerAccountId": "acct_01J00000000000000000000000",
  "accountEpoch": 7,
  "state": "materialized",
  "adapter": {
    "adapterId": "generic.csv",
    "adapterVersion": "1.0.0",
    "artifactDigest": "cccccccccccccccccccccccccccccccccccccccccccccccccccccccccccccccc"
  },
  "sourceObjectHash": "aaaaaaaaaaaaaaaaaaaaaaaaaaaaaaaaaaaaaaaaaaaaaaaaaaaaaaaaaaaaaaaa",
  "parsingOptionsHash": "dddddddddddddddddddddddddddddddddddddddddddddddddddddddddddddddd",
  "candidateSetHash": "eeeeeeeeeeeeeeeeeeeeeeeeeeeeeeeeeeeeeeeeeeeeeeeeeeeeeeeeeeeeeeee",
  "previewHash": "ffffffffffffffffffffffffffffffffffffffffffffffffffffffffffffffff",
  "counts": {
    "candidate": 1200,
    "duplicate": 110,
    "rejected": 8,
    "warning": 14
  },
  "warningCodes": ["IMP_ROWS_REJECTED"],
  "createdAt": "2026-07-16T02:00:00Z",
  "expiresAt": "2026-07-17T02:00:00Z",
  "security": {
    "immutable": true,
    "applyRequiresExactHash": true,
    "reparseAtApplyAllowed": false,
    "rawContentInMetadataAllowed": false
  }
}
